,Content,Location,Username,Retweet-Count,Favorites,Created at
1575,I’m hearing districts say the fall distance learning will be much “improved” from spring. They are proposing synchronous zoom all morning?!! Is that better!? Even adults have a hard time zooming for more than an hour. #education #k12 #distancelearning,Oregon,SRazz1,0,4,2020-08-10 14:56:22
1576,Learning under the tree...with social distance..somewhere in remote village....#education #nature #coronatimes https://t.co/mjheozH07W,India,Kruthika1233,1,1,2020-08-10 14:53:39
1577,"#StudyFromHome: Pursue your management program from NMIMS - India’s Top Management University through a highly advanced &amp; immersive online learning platform.

Reimagine management education with India’s Largest Ed-Tech University, know more: https://t.co/72XcduKpmU

#NMIMS https://t.co/Z4KQpkHOaO",,NMIMS_SCE,0,6,2020-08-10 14:50:59
1578,Schools are handing out tens of thousands of the basic laptop computers and arranging Internet connections for students who would otherwise be left in the lurch https://t.co/9ZFnhzDHjw,"Las Vegas, NV",reviewjournal,4,15,2020-08-10 14:40:00
1579,Taking distance learning ‘offline’: Lessons learned from navigating the digital divide during COVID-19 https://t.co/ySbIVHEYJK @BrookingsInst https://t.co/iftP1lhmNw,"Washington, D.C.",KnowledgeAll,0,0,2020-08-10 14:30:38
1580,"For Native Americans living on reservations in San Diego County and throughout the country, simply getting a good enough signal to attend online classes can require an epic effort difficult enough to discourage even the most dedicated students. https://t.co/Hm7PqGkUwD https://t.co/6Ce4jrypcM","Rockville, MD",IndianAffairs,5,8,2020-08-10 14:29:32
1581,@avnahijaa @siddhant1502 @thalaivaoppai Who's more likely to have high quality masks and sanitizers? Who's more likely to have received a lifelong quality education making them responsible people who know to social distance? Who's test centers are more likely to be crowded over the National average?,,d_mehndiratta,0,2,2020-08-10 14:26:59
1582,@Brasilmagic Here’s some truth: at this juncture it’s almost pointless to do online/distance education too. My daughter’s school is trying and we just spent 45 minutes on a conference call that didn’t work 95% of the time and accomplished nothing.,,DRMspec,0,0,2020-08-10 14:19:21
1583,"Join @wwt_inc and @vyopta on August, 20th at 11am PDT for an exclusive virtual Tech Talk Thought Leadership Panel! You will learn what key players at UNT, University of Arizona, UVA, and Cisco have to say about distance learning metrics. Register today! https://t.co/cMCiMBMoK2","St Louis, MO",madcowriz,0,0,2020-08-10 14:11:27
1584,"Equity is without a doubt the biggest challenge with distance learning: ""It would be nice to see our wealthy districts collaborating with their [...] less wealthy neighbors. How can we help you and share resources?"" #education #distancelearning https://t.co/ok22LBTowE","Providence, RI",AndreaGlauber,1,2,2020-08-10 14:10:56
1585,"Maybe if DeSantis had not listened to his Orange boss and taken the virus more seriously... But he was busy being a Fox News star for keeping Florida open. How'd that work out?

Lessons learned from Miami schools online distance learning | Miami Herald https://t.co/D9RoLJcVa7","Florida, USA",SaveOurDemocra6,0,0,2020-08-10 14:05:39
1586,"A must-read for teachers as you begin planning for the 2020-21 school year, whatever shape that may take #education #distancelearning https://t.co/uDq9ys6ZMu","Providence, RI",AndreaGlauber,1,1,2020-08-10 13:50:21
1587,"Great Q &amp; A about distance learning from @DailyBreezeNews, including testing, special education rules, and the importance of routines and managing stress. #InThisTogether #OnlineLearning https://t.co/TQoNuOrcDG","Gardena, CA",TanyaForLAUSD,0,5,2020-08-10 13:47:50
1588,"Learn how to EASILY create videos for distance learning.

Early-bird pricing on the new online course for teachers ends Wednesday.

https://t.co/tkL5Ai1zka

#education #distancelearning #remoteteaching #remotelearning #learnfromhome #edutwitter #teachertwitter #edchat #teaching","Austin, TX",GibsonEdu,0,2,2020-08-10 13:46:17
1589,"I’m attending The National Education Association’s event, “Webinar: Planning for a Week of Distance Learning” – sign up now to join me! #StrongPublicSchools https://t.co/eGcGZm4kPg @RedClaySchools @teamredclay","Wilmington, DE.",HighlandsPride,0,1,2020-08-10 13:35:59
1590,National Council for Higher Education (NCHE) has granted Cavendish University Uganda permission to roll-out Open Distance and E- Learning for all its programmes currently accredited. CUU is among the first Universities in #Uganda officially permitted to conduct Online teaching. https://t.co/k488qRn36K,Plot 1469 Ggaba Road Nsambya,CavendishUg,10,28,2020-08-10 13:35:46
1591,Clark County students get Chromebooks for distance learning https://t.co/AMb0BTlrUD,Las Vegas,RJpolitics,0,1,2020-08-10 13:34:04
1592,It’s the first day of school for Oakland Unified School District students.📚 There’s no official distance learning plan yet because the district and Oakland Education Association still haven’t agreed on what distance learning will look like. https://t.co/Nly0BghqVu @KTVU,Bay Area,szendehnam,7,14,2020-08-10 13:25:32
1593,How Can We Make the Most of Synchronous and Asynchronous Time in Distance Learning? https://t.co/WGvplI5H0e via @Getting_Smart @katiemartinedu #education #distancelearning,Pittsburgh,Rdene915,6,4,2020-08-10 13:24:33
1594,"Join @wwt_inc and @vyopta on August, 20th at 11am PDT for an exclusive virtual Tech Talk You will learn what key players at UNT, University of Arizona, UVA, and Cisco have to say about distance learning metrics. https://t.co/Bh0J0PpH6W #SiliconValleyinSTL","Hampton, NH",johnjrosssr,0,0,2020-08-10 13:23:25
1595,"With school fast approaching during a global pandemic St. Edmond Catholic School is allowing parents to decide how their children will be educated.

The three models of instruction available include: onsite learning, hybrid learning and distance learning.

https://t.co/TmUfc4fLDM https://t.co/ojMFkkUEEI","Fort Dodge, Iowa",Messenger_News,1,3,2020-08-10 13:21:56
1596,"Good Morning,  how are you today? How are you feeling? This Saturday will be a HAUP Motorcade starting at 11am. Maintaining a safe distance is important while also education people about the Census.  Come join us! #motorcade #brooklyn #haup #cars #travel #Census2020 https://t.co/KYwgqRCHpH",New York,HAUPINC,1,2,2020-08-10 13:14:54
1597,"@FitzKris10 @RickKing16 Because if we don't open schools, our children will be months behind the rest of the world educationally and will need a time machine to travel into the future to visit the rest of the world!

Or we could do online distance education. That could work as well.","Houston, TX",MisterUltimate,0,1,2020-08-10 13:11:20
1598,"Are you interested in learning about new American technologies and discovering opportunities to partner with American education institutions? Sign up for the EdTech and Distance Learning Virtual Connect Program webinar holding today. 
Visit- https://t.co/A78khBCzaW",,USCSNigeria,2,3,2020-08-10 13:07:42
1599,"Bridget Brown, a senior in the Department of German, Nordic, Slavic &amp; Dutch, discusses adapting to distance learning and how her liberal arts education helped her better understand the different aspects of COVID-19. #UMNProud https://t.co/DBR2kKTxOa https://t.co/KfNIKfysLs","Minneapolis, MN",umncla,2,2,2020-08-10 13:03:32
1600,"With support from the MIT Governance Lab, the South African civic technology organization Grassroot has developed a first-of-its-kind training course entirely on WhatsApp.
https://t.co/lcLEpkV4yJ
#education #technology","Cambridge, MA",mit_ili,2,0,2020-08-10 13:01:49
1601,"🍎 📚 Any classroom can become a hybrid classroom with the Meeting Owl, the smart conference camera that captures 360° video and audio for engaging distance learning. Learn more here: https://t.co/UFDBcG8fkk

#Education #WorkRemote #HybridLearning","Somerville, MA",OwlLabs,0,0,2020-08-10 13:01:01
1602,Back to School Resources for Distance Education https://t.co/Qy1dg97P2e),"Portland, ME",eLearningChris,0,0,2020-08-10 12:58:00
1603,Some ideas for another challenging year in education. https://t.co/1pMtsdPEZd,"Accra, Ghana",kdsteadman,0,0,2020-08-10 12:55:08
1604,"@LarryScott1919 Distance learning was a challenge in EVERY school district. Public education can’t BY LAW be selective, pick students who are self motivated or well off - I’m utterly confused by the point of this story.","Springville, NY",jess_schuster,0,0,2020-08-10 12:54:17
1605,@paysupplystaff @ShuaibKhan26 Evidence from talking to other parents. I can’t believe you don’t think that children not being able to socially interact with other children and not being able learn together in a classroom isn’t bad for them. Or are u suggesting distance learning has had no impact to education?,England,domwest74,0,0,2020-08-10 12:49:08
1606,4 Reading Resources to Use with Students in Distance Education #Education via https://t.co/uYrZyCEzyT https://t.co/RhlMrd4VDd,Israel,THInsight1,0,0,2020-08-10 12:42:32
1607,@mutuyi @AgahozoB @ikisraela @AlainMucyo1 @KalindaMwene @ellen_kampire @peaceduiniative @REBRwanda @rwanda_future @HigherHec I totally agree . #Africa needs to take advantage of the rise of online course and online job market . They need to invest in the education that will allow #African youth to compete in the future of long distance learning and long distance working,,julietmbabaz,0,1,2020-08-10 12:36:23
1608,"I don't believe 'online schooling isn't for everyone.' Why? Bad education isn't the fault of the students. Educators should have started a hybrid education years ago.

Online school: This is what it should look like in the fall - CNN https://t.co/pzuDHzOVRU","Flowery Branch, GA",mjbrandonbowers,0,0,2020-08-10 12:31:31
1609,"Riverside, Chino Valley school districts start academic year with distance learning https://t.co/nHdJr3ks6y",,ABC7,8,12,2020-08-10 12:30:59
1610,Our new guide provides options for school systems to ensure all students receive quality #education thru distance learning w/ awareness that tech access inequity disproportionately affects low-income &amp; rural communities: https://t.co/3E4UMsVFL1 @hgse @harvard @HarvardCEPR https://t.co/ZjOC9tL6Lc,"Cambridge, MA",EdRedesignLab,2,0,2020-08-10 12:30:25
1611,Don't forget the cut off date for our September distance learning courses is this Friday 15th August https://t.co/KrS0NOuW73 #distancelearning #liftindustry https://t.co/uI6WwCLDUl,UK,LEIAvoice_UK,0,0,2020-08-10 12:30:05
1612,@BBCNews Please ask @BorisJohnson and those demonising education unions to explain why they think unions don't want children to go back to school. What do unions gain from teachers having to continue teaching students at a distance - more difficult/less satisfying? #bbcwato,,DrTayStew,0,0,2020-08-10 12:28:49
1613,"I'm sorry but, how you gonna have the first day of school but there's no agreement in place between teachers and schools.
C'mon Oakland.
https://t.co/0NTIAHJAF0","San Francisco, CA",reggieaqui,0,8,2020-08-10 12:28:36
1614,"Participants can participate in their local community, contributing to the overall distance by walking, running, cycling or swimming. Alternatively they can join our core team and seasonal staff at The Mountbatten School.","Hampshire, UK",P_B_Education,0,0,2020-08-10 12:25:48
1615,"I look at how distance learning has worked, with chrome books, and I think yes—we can do this effectively. If our children are given access to education, why can’t their families be given due process? (10)","Baltimore, MD",AuntieJustice,0,0,2020-08-10 12:25:45
1616,"The success of distance education heavily relies on the control that learners have. Students who percieve that their academic success is a result of their oersonal accomplishment have internal locus of control and more likely persist in their education (Altmann &amp; Arambasich,1982)","Birmingham, England",d_almaruf,0,0,2020-08-10 12:25:36
1617,"Distance is determined by the amount of dialogue that occurs between teacher and learners. Thus, transactional distance exists in all educational relationships. Not exclusively in online education (Moore, 1990). https://t.co/6mgLbbHXHw","Birmingham, England",d_almaruf,0,0,2020-08-10 12:25:34
1618,"#Teachers, take student notebooks virtual with our Virtual Writer's Notebook for #GoogleClassroom and #DistanceLearning + PDF https://t.co/n4T0UH0OEA #teacherspayteachers #education #writersworkshop #teachwithtech #edchat #edtech ##backtoschool #learnfromhome",USA,MrEduTechnology,0,0,2020-08-10 12:15:49
1619,Take some pressure off of 2020's virtual #BacktoSchool with our Mega Bundle for #GoogleClassroom and #DistanceLearning https://t.co/Dka2WNRWm1 #teacherspayteachers #edchat #edtech #teachwithtech #education #teachfromhome,USA,MrEduTechnology,0,0,2020-08-10 12:14:13
1620,"@paysupplystaff @ShuaibKhan26 For the majority of kids the distance learning has been setting work on a Monday and leaving them to it, once submitted having no feedback on how they did. If you don’t think that’s a risk you shouldn’t be involved in education.",England,domwest74,0,0,2020-08-10 12:00:26
1621,"Getting ready for the beginning of the school year? Here are some ideas for creating activities and shorten the distance between you and your students with Flat for Education during remote learning: https://t.co/7jduHsD3kZ
#remotelearning https://t.co/Rf28iZsAwu","UK, US, FR",flat_io,0,0,2020-08-10 12:00:23
1622,"Education Minnesota, the state’s teachers union, wants to continue with distance learning in the fall, but hosted an in-person event last week for its annual Teacher of the Year award. https://t.co/pZu8m0t8Ak",,AlphaNewsMN,120,123,2020-08-10 12:00:01
1623,"Mashups can be great in music, like @rickastley and Nirvana, and also in education. See how #microschools can be paired with rigorous #distancelearning for success. via #Edchoice expert @matthewladner #sayfie #FlaPol https://t.co/6MnMY8nUdc https://t.co/erUnF8ysdl","Florida, USA",redefinEDonline,3,5,2020-08-10 11:52:43
1624,"Hurry Up... Freedom Offer..
*B.ED-M.ED*
 call: 9555177741, 8851204715
#bed #education #distance_learning #svimt #college
#best_institute
#distancelearning #graduationcourses #online_coaching #onlincoaching #freedomoffer #15august #independenceday #india https://t.co/ugloYDhDkl",,svimt,1,0,2020-08-10 11:46:57
1625,"This is what distance learning should look like in the fall
https://t.co/BG70Fo4yFf
 #Education",Internet,EducationNews_b,0,1,2020-08-10 11:41:08
1626,"@DrMaireadDB @darachk @NormaFoleyTD1 The sign indicates a physical distance of 2m and PPE to be worn.
 
However, in 2 weeks we'll open our doors to hundreds (1200) of students. There will be little or no physical distance, maybe 0.9m if they don't move on their seat.
When will @Education_Ire start a real discussion!",Ireland,SilentPrincipal,4,18,2020-08-10 11:27:00
1627,Second Look: Cover Story: Distance Learning https://t.co/dHUo81kP70 https://t.co/KwDLEJUndF,"Manila, PH",gadgetsmagazine,0,0,2020-08-10 11:26:47
1628,"Live in Lee G &amp; thinking about secondaries? Fewer families are looking further afield &amp; more of us are opting for Lewisham Community schools. Great schools, walking distance &amp; part of yr community. Keep an eye on https://t.co/9yP9SKjoFp be in touch to connect wi current parents","Lewisham, London",OctaviaLewisham,3,8,2020-08-10 11:18:51
1629,"@ProudofNI @niexecutive @healthdpt @Economy_NI @deptinfra @Justice_NI @CommunitiesNI @daera_ni @dptfinance @ExecOfficeNI @Education_NI Good point, well made... hand washing encouragement seems to have vanished and there is so much confusion over 1 or 2 metre social distancing nobody knows what to do.

How about this for clear messaging; 

- wear a mask
- wash your hands
- keep your distance

Not so difficult?",Belfast,CreationByCC,0,5,2020-08-10 11:05:35
1630,"Our 'Education in times of crisis' report looks ahead to reopening and what needs to be considered. 

Read more about the views of our members on what comes next for the #FutureOfTeaching: 

https://t.co/mFlfsqwrVW https://t.co/3Mw1N32Dsd",United Kingdom,CharteredColl,3,2,2020-08-10 11:01:34
1631,"The only NAAC A+ grade accredited #privateuniversity to offer #distanceeducation, affordable fee structures, student-centric #education, #placement support at CU-IDOL are some of the many reasons to join us. Register here: https://t.co/zcrP6p2IIF       https://t.co/03eHq5OSzm",,cu_distance,0,0,2020-08-10 10:51:59
1632,"A distance education or online learning approach isn't easy, but we need to do it and improve it regardless of the initial problems the country might face. https://t.co/As6zVpX0vx",Philippines,rapplerdotcom,2,14,2020-08-10 10:49:53
1633,#education 10 Things To Do in the First Weeks of School to Connect with Learners in Distance Learning – KATIE MARTIN https://t.co/hpRIlxTi9t https://t.co/1WJE95L1Ly, ,john_jpollock,0,0,2020-08-10 10:40:34
1634,"@fresh_boyx69 @yomattyu Its like that viral video when there was a race but before the race started, those whose parents were still together, education got paid for by parents, etc were all asked to take a step forward each time. Point: advantage. These people have a shorter distance to run.",,Katarina_8426,0,3,2020-08-10 10:38:13
1635,Department of Education Secretary Leonor Briones earlier expressed confidence that this school year will push through as planned using the blended/distance learning approach with the help of all education stakeholders. https://t.co/uP0dsywJt7,Philippines,PanahonTV,0,0,2020-08-10 10:36:24
1636,"UK: You have of course been broadcasting lessons on TV too. Coz to not do so in current climate would be incompetence. Some things work fine at a distance, some don't. Education does (mostly).

@DinahRoseQC @JMPSimor https://t.co/d0tj7h3DKL",Earth,AdvanceSoftware,0,0,2020-08-10 10:34:22
1637,"@ErdmuteD They just want teachers back to work so that they can use them as glorified childminders. Distance learning has been a thing in some countries for years, so it’s quite possible to do a similar thing in the UK during a pandemic https://t.co/QMylKvzWpz","England, United Kingdom",NiSibeal,0,1,2020-08-10 10:33:56
1638,"New Bellringer video today, THE SOUTHERN COLONIES. Possible class warm-up, review, or distance learning option. Questions in video description 
https://t.co/M4GaPtxKYy

#sschat #socialstudiesmatters #eLearning #edchat #edtechchat #edchat #education #ushistory #americahistory https://t.co/oE3R8vgBjq",,BellringerThe,0,0,2020-08-10 10:33:50
1639,@cbngov_akin1 @adeyanjudeji @saidu_ak You know Deji and his brain together with commons sense are experiencing social distance.  He does not know where he belong today Politician PDP tomorrow activist. This guy  need some education and sense.,Lagos Nigeria West Africa,Ladi_Ikudayisi,0,2,2020-08-10 10:33:02
1640,"@GCraughwell @EdChatEU @IrishEducation A lot of issues could be solved if distance learning was an option. 

It would give room for the children who need to attend in person. 

There are many parents who are going to be pushed out of mainstream education to homeschool because they are Very high risk.","Kildare, Ireland",TinkyTaylor546,2,16,2020-08-10 10:28:20
1641,"I disagree w this text &amp; find it condescending if not colonizing in its approach to students w special education needs. As parents of swsen, we know that advocating for our children, potentially more profoundly impacted by distance learning, is key. Instead of telling me  (1/2) https://t.co/Xlpcj4SAMj",unceded Algonquin territory,sksmithedu,0,4,2020-08-10 10:27:24
1642,"The new normal is going to be learn from home. The books are going digital, classroom virtual and education is getting online and distance. The perfect blend of where technology meets learning. Go for distance education.
#éducation #onlineeducation #onlineeducationplatform https://t.co/SrxNYPOMcV","Noida, India",CollegeVidya,0,1,2020-08-10 10:27:15
1643,"China Distance Education Holdings Limited to Report Third Quarter Fiscal Year 2020 Financial Results on Wednesday, August 26, 2020 https://t.co/IkyRM8eVV5","Florida, USA",feed_stocks,0,0,2020-08-10 10:27:05
1644,We knew he would come good in the end! @sgslive went for distance and we are confident it went a long way! We have flung a @LEGO_Education prize in his direction. Thanks for your flingtastic creation - a great contribution to the #SUMMERofSPIKE https://t.co/GRn5mufEi3,"Moreton Paddox, England",raisingrobots,0,3,2020-08-10 10:15:54
1645,UCC College of Distance Education resume lectures after COVID-19 break https://t.co/kM7U3JOWFz,"Accra, Ghana",thegbcghana,0,4,2020-08-10 10:08:54
1646,@Phanatic_TWMS @DTMRickey @LincolnKupchak @CNN When has it ever been about people? Was it when they shoved the most vulnerable in the most vulnerable of places? Was it when they forced you to distance yourself from loved ones maybe it's when they decided that kids don't really need an education.,"Ohio, USA",Emmettduvall,0,0,2020-08-10 10:04:16
1647,"$DL China Distance Education Holdings Limited to Report Third Quarter Fiscal Year 2020 Financial Results on Wednesday, August 26, 2020 https://t.co/JSRqvKhxy7","Winnipeg, Manitoba",otcdynamics,0,0,2020-08-10 09:33:53
1648,"Is prone to becoming tongue-tied
Is good at athletics and physical education, especially long-distance running
#Juri",,AKB48Fans2,0,0,2020-08-10 09:28:10
1649,Distance teaching has turned me into an instructor; I am no longer a teacher. Dispatches from quarantine published my letter to Education Administrators https://t.co/2U0RqHRIG5 #amwriting #teachersareessential #teachertwitter #teacher,"Montclair, NJ",RichardFulco,1,0,2020-08-10 09:19:12
1650,"$DL [15s. delayed]: Issued Press Release on August 10, 05:00:00: China Distance Education Holdings Limited to Report Third Quarter Fiscal Year 2020 Financial Results on Wednesday, August 26, 2020 https://t.co/JLXOlVIuYU","New York, USA",FlashAlert_me,0,0,2020-08-10 09:18:30
1651,"@UHirschkorn Agreed. Especially if further school closures are necessary, where is the govt spending on education and children’s well-being? I’m sure some of the billions spent propping up rich business could be spent supporting schools that are struggling with distance teaching.","Birmingham, England",WillPopplewell,0,0,2020-08-10 09:09:01
1652,"China Distance Education Holdings to Report Third Quarter Fiscal Year 2020 Financial Results on Wednesday, August 26, 2020 $DL https://t.co/YVEO4QK4Qe","New York, NY",newsfilterio,0,0,2020-08-10 09:04:32
1653,"$DL China Distance Education Holdings Limited to Report Third Quarter Fiscal Year 2020 Financial Results on Wednesday, August 26, 2020
https://t.co/rk06ymnI7Y",,stock_titan,0,0,2020-08-10 09:00:34
1654,"Study at your pace and from your own home...

... but get the breadth of experience and input that you would expect from a classroom course

https://t.co/7c49SS291I

#BachFlowerRemedies #DrBach
#BachFlowerEssences #EdwardBach https://t.co/F8beckb8Y7","Sotwell, Oxfordshire, England",BachCentre,1,3,2020-08-10 08:43:00
1655,"@DrRPNishank 
Respected HRD Minister,
Kindly consider the plea of NIOS STUDENTS the board has done in justice with the distance learners in terms of marking . Most of the learners are under greif and pressure regarding the future higher learning and education",,hemkanchan,0,0,2020-08-10 08:41:28
1656,"A distance education or online learning approach isn't easy, but we need to do it and improve it regardless of the initial problems the country might face. https://t.co/VFJ2Dp1uTQ",Philippines,MovePH,0,0,2020-08-10 08:33:50
1657,"A student holding a https://t.co/4GzXPf8wCy Degree is well prepared to sustain as a corporate employee or as an entrepreneur. Apply in top distance education universities.
https://t.co/eprtGc3gML 

#bcom #admission2020 #distancelearning #topuniversities","New Delhi, India",distance_school,1,1,2020-08-10 08:10:47
1658,"Today's the last day to register your interest in L3 Access to Higher Education Diploma in Social Work Studies!⁠
⁠
Perfect if you want a career working with children, young people &amp; families. Visit https://t.co/lpElpOffMA
⁠⁠⁠
#Darlington #Darlo #AccessDiploma https://t.co/F6EYsTYY0f",Darlington,darlingtonl_s,2,1,2020-08-10 08:01:27
1659,"Don't miss out on the opportunity to learn all about the main #qualitative and #quantitative #research approaches and how to apply them during the MSM Research Methods and Skills program, offered via distance learning.  You have 10 days left to apply: https://t.co/o05qFvfTaQ https://t.co/Fkp71Qx3vQ",Maastricht,ExperienceMSM,0,1,2020-08-10 08:00:33
1660,"Man, fuck anxiety and fuck whoever thought it was a good idea to have schools reopen when distance/virtual education is a viable option. https://t.co/DnNQriZPJv",This unfortunate existence,credens_j,0,1,2020-08-10 07:48:40
1661,"Refining a career in open, distance and e-learning.  Read more
https://t.co/2wTPiCgevJ
#CEDU #UnisaCEDU https://t.co/wcxzwpFqNJ",,unisa,4,19,2020-08-10 07:45:03
1662,"6/ Unfortunately, the data has not been separated according to what study model the children had during spring. Children and teens aged 10-16 studied in school, while teens aged 16-19 participated in distance education.","Vancouver, BC",lnormen,0,0,2020-08-10 07:39:45
1663,@JohnSwinney I think you need to reconsider full time education and start with the blended learning. Its ok for staff to social distance but our kids can all mix with each other 🤔,"Scotland , Coatbridge",lauradenny1,0,6,2020-08-10 07:34:57
1664,6 Great Distance Education Books for Teachers and Educators https://t.co/GGKQ6txepB,"England, United Kingdom",nick_chater,0,0,2020-08-10 07:26:25
